catalog_key,event_key,first_seen_at,last_seen_at,seen_count,last_bucket,last_tier,max_materiality_score,title,source,url,published,summary
nextdc receives development approval for m4 campus in melbourne australia,nextdc receives development approval for m4 campus in melbourne australia,2026-05-11T12:36:19Z,2026-05-11T12:36:19Z,1,ANZ DC,MEDIUM,0.790,"NextDC receives development approval for M4 campus in Melbourne, Australia - Data Center Dynamics",Data Center Dynamics,https://news.google.com/rss/articles/CBMiuAFBVV95cUxPaDBBWVdidFN0MDlWUE9GWWNXaEJlUjd0Z2JUYlB6OVRjNklBUWlVbmVTX3dIMGdWSDYwSVpqNlBFeUdYTGlRZTk4WmtTODZvZzZ0bXV4S0FfSERWTWpncUFmV2Q5VldNalcyV2QwWFdlSFA5VTY0NnhkWnhzMzI4Q1dTLUZjMEJsYXFjZ0dXS2I5dmlrRVJjNU5Xa0tyZ0hBSzB2RVB6UHNzTTZTWDd4UDNLNVdRY1V6?oc=5,2026-01-19T00:00:00+00:00,
infratil s cdc stake hits 8b as datacentre expansion drives valuation surge,infratil s cdc stake hits 8b as datacentre expansion drives valuation surge,2026-05-11T12:36:19Z,2026-05-11T12:36:19Z,1,ANZ DC,MEDIUM,0.680,Infratil’s CDC stake hits $8b as datacentre expansion drives valuation surge - BusinessDesk | NZ,BusinessDesk | NZ,https://news.google.com/rss/articles/CBMiuAFBVV95cUxNTE1JSlBqZ1BOWlRHSzZQTlVzX293Wks5ZVJlcnlCODhVeUkyME5fTERmaUp1MjIxRTZSSEp0dzRoamN1SzZwNG9uYmZFWF96RFZ2bW9PX0s0c2p4TVVhdmR1YUVmVE1ENjV6Z2tKbllFTUdJZ3o0Wi1naU1pWTNVT1I5QUJ3UlcyYUJYQ3FIVU8yYmVnS1NiWHdJb0FiUHhzZzBtekJOeTUwNjFfcy0yNXBiYnphSnJx?oc=5,2026-01-06T00:00:00+00:00,
airtrunk acquires site in melbourne australia for 354mw data center,airtrunk acquires site in melbourne australia for 354mw data center,2026-05-11T12:36:19Z,2026-05-11T12:36:19Z,1,ANZ DC,MEDIUM,0.670,"AirTrunk acquires site in Melbourne, Australia, for 354MW data center - Data Center Dynamics",Data Center Dynamics,https://news.google.com/rss/articles/CBMisAFBVV95cUxOTVFnbW9uRWxtWldiMUdNaElUVjJQVnlGelpoaHBTV3RmOTBUdHZlTkM4bWxlU09Ma2t0Q3NQMEpoUjFfNmRCemh4T3Z1SW56STNFVDd1Smo0OWJoRXNJa2dsbURobkhWT3FpaHhKYk9sbG1tbnVZcFJyUjVhY1dxalQtXzhfNXlfMlhHTXJuVjRqMURlNlIxX001V3hZblpHM2lqaVZ4ZTZSWW4zTjdZaQ?oc=5,2025-12-24T00:00:00+00:00,
goodman-1gw-data-centre-power-bank,goodman-1gw-data-centre-power-bank,2026-05-11T12:36:19Z,2026-05-11T12:36:19Z,1,ANZ DC,MEDIUM,0.490,Australia's Goodman Group adds 1GW to power bank for data center projects - Data Center Dynamics,Data Center Dynamics,https://news.google.com/rss/articles/CBMitwFBVV95cUxORzVzSHlNSVk2QlBYM3NzbGZHdFJWSU04cVlBZXVtZkpld0FoQVFkMTVEUmk1M1JTQWxSWFNNVW9XYlFCcWlJLTRVTUJtVzZQYmNkWkNEZVlzanJwOUJ0WWFvYmx0cm1VSDFiZEhkU3lmUUQtTEtzd0ZJRURpOGJPSDlsa193QWdkQ3JoLWRqNzlSSGxPa19FSkZJN2dOa0UwcE92bjBvTUhqcERNc1ZnM2JHa1g3RlE?oc=5,2026-02-20T00:00:00+00:00,
infratil gains 174m on cdc data centres revaluation,infratil gains 174m on cdc data centres revaluation,2026-05-11T12:36:19Z,2026-05-11T12:36:19Z,1,ANZ DC,MEDIUM,0.490,Infratil gains $174m on CDC Data Centres revaluation - Capital Brief,Capital Brief,https://news.google.com/rss/articles/CBMixgFBVV95cUxQYmFOU296eHdGcm5vSUNuTUdJem5DMWlSWE1IZVhDYWJUdDdFR0tJYXg3bC1ET25GU25iSGZRaURKeWR3R21nR3ZkaUZBZGFsRWE5ODVHS0NqbUFpc0I0OXB0eUJkc1BTOTRpSzc4MjdVOEZNOHdjVEg5ZzlzYldyV0JMZFgxTThsY2h2d3BRUlFIaWpnQkRGaFdRWVRfM01ScjdCZFF4cmZmRFNEcThiZjYxc2pOdVdOc2s1S2xXQnNFRWYxVHc?oc=5,2026-01-06T00:00:00+00:00,
